{"schema_version":"1.0","name":"Fixture LAN","nodes":[{"id":0,"external_id":"host:fixture","label":"Host","type":"computer","addresses":["192.0.2.10"],"evidence":"local_interface"},{"id":1,"external_id":"segment:fixture","label":"Segment","type":"network_segment","evidence":"interface_prefix"}],"links":[{"from":0,"to":1,"bandwidth":100,"delay":1,"loss":0,"inferred":true,"evidence":"shared_segment"}],"warnings":[]}
